{
  "case_id": "DEMO-COM-INCONSISTENCIAS-001",
  "ug": "158000",
  "competencia": "06/2026",
  "sources": [
    {"id": "BAL-ERR", "type": "balancete", "origin": "exportacao_fornecida"},
    {"id": "CONCONTIR-01", "type": "CONCONTIR", "origin": "relatorio_fornecido"},
    {"id": "DEM-ERR", "type": "demonstracoes", "origin": "exportacao_fornecida"}
  ],
  "rules": {"balance_tolerance": "0.01"},
  "accounts": [
    {"code": "1.1.3.8.1.00.00", "name": "Conta transitória", "nature": "debit", "opening_balance": "1000.00", "debits": "100.00", "credits": "0.00", "closing_balance": "-900.00", "age_days": 120, "max_age_days": 30, "evidence_ids": ["BAL-ERR"]},
    {"code": "1.2.3.0.0.00.00", "name": "Conta sem documento", "nature": "debit", "opening_balance": "200.00", "debits": "0.00", "credits": "0.00", "closing_balance": "200.00", "evidence_ids": []}
  ],
  "equations": [
    {"id": "EQ-0042", "left_value": "500.00", "right_value": "450.00", "tolerance": "0.01", "severity": "high", "evidence_ids": ["CONCONTIR-01"]}
  ],
  "statements": {"assets": "1000.00", "liabilities": "600.00", "net_equity": "300.00", "evidence_ids": ["DEM-ERR"]},
  "external_findings": [
    {"source": "CONINCONS", "code": "INCONS-001", "title": "Inconsistência externa", "description": "Registro importado de relatório fornecido pelo usuário.", "severity": "medium", "evidence_ids": ["CONINCONS-NAO-ANEXADO"], "normative_ref": "Macrofunção 02.03.15 — item a confirmar na redação vigente", "action_class": "analisar_achado_externo"}
  ]
}
